
<html>
<head>
  <link rel="stylesheet" href="website/styles.css">
  <title>Chris Henson</title>
  <meta name="viewport" content="width=device-width, initial-scale=1.0, maximum-scale=1.0, minimum-scale=1.0">
  <link rel="icon" href="website/icon.ico" type="image/x-icon" />
</head>  
  <body><br>

<center>
    <div style="display: inline-block; vertical-align:middle;">
<a href="/" style="text-decoration: none; font-size: 32;"><b>Chris Henson</b><br>
</a><hr/><div style="text-align: justify;display: inline-block; width: 100%;">
<a class="title" href="http://chrishenson.net/">ARTICLES</a>
<a class="title" href="http://chrishenson.net/website/about.html">ABOUT</a>
<a class="title" href="http://chrishenson.net/website/contact.html">CONTACT</a>
<a class="title" href="http://chrishenson.net/subscribe/subscribe.html">SUBSCRIBE</a>
</center><br>


<div style="margin-bottom: 3ch;text-transform: none;">
</div>
<div class='heading'>About this site</div><hr/>
<p>
This is my personal website. I'll be posting articles about mathematics, statistics, and programming.
</p>

<div class='heading'>Articles</div><hr/>
<p style="text-align: left;">
07/12/2020: <a href="http://chrishenson.net/website/fib_power.html" data-date="2020-07-12">A Fibbonacci Power Series</a><br>
06/19/2020: <a href="http://chrishenson.net/website/complex_regression.html" data-date="2020-06-19">Regression with Complex Numbers in Python</a><br>
06/17/2020: <a href="http://chrishenson.net/website/root.html" data-date="2020-06-17">Fast Inverse Square Root</a><br>
06/12/2020: <a href="http://chrishenson.net/website/regression.html" data-date="2020-06-12">What is Regression?</a><br>
06/07/2020: <a href="http://chrishenson.net/website/integral.html" data-date="2020-06-07">Integration in Python and Haskell</a><br>
06/05/2020: <a href="http://chrishenson.net/website/bertrand.html" data-date="2020-06-05">The Bertrand Paradox</a><br>
06/03/2020: <a href="http://chrishenson.net/website/memo.html" data-date="2020-06-03">Memoization with Fibonacci and Collatz Sequences</a><br>
05/29/2020: <a href="http://chrishenson.net/website/zeta.html" data-date="2020-05-29">The Riemann Zeta Function</a><br>
05/27/2020: <a href="http://chrishenson.net/website/basel.html" data-date="2020-05-27">The Basel problem</a><br>
05/25/2020: <a href="http://chrishenson.net/website/infinite_series.html" data-date="2020-05-25">Infinite Series in Haskell</a><br>	
05/24/2020: <a href="http://chrishenson.net/website/mathjax.php" data-date="2020-05-24">Using MathJax to Display Equations in HTML</a><br>
